{
  "schemaVersion": "1.0.0",
  "metadata": {
    "slug": "five-materials-for-5-to-12-gtco2-year",
    "title": "Five Materials That Could Unlock 5–12 GtCO₂/Year",
    "date": "2026-07-09",
    "status": "draft",
    "license": "CC BY 4.0",
    "version": "1.0",
    "articleUrl": "https://lupine.science/articles/five-materials-for-5-to-12-gtco2-year/",
    "eyebrow": "Climate materials portfolio",
    "deck": "A compact, auditable record of the article’s claims, source figures, data, methods, and institutional responsibility.",
    "documentId": "LS-PP-2026-005",
    "evidenceStatus": "Needs verification"
  },
  "summary": {
    "claim": "The draft article proposes that five climate-relevant material classes share a defect-mediated prediction problem and may benefit from correction of systematic model error.",
    "verdict": "open",
    "scope": "Draft portfolio thesis; this pack does not independently verify the aggregate impact range, target thresholds, or internal blind-prediction result.",
    "limitations": [
      "Impact ranges are conditional scenarios, not deployment forecasts.",
      "Commercial outcomes depend on scale-up, policy, and partner validation beyond this evidence record.",
      "The aggregate impact range, target thresholds, and internal blind-prediction result remain needs-verification."
    ],
    "lead": "This pack preserves a draft portfolio thesis and its selected figures without upgrading article-level scenarios or internal results into verified facts.",
    "findings": [
      { "label": "Scenario", "text": "The draft article reports a combined climate opportunity range; this pack retains it as needs-verification, not as a forecast." },
      { "label": "Prior art", "text": "Peer-reviewed literature supports systematic softening of universal potentials away from equilibrium." },
      { "label": "Boundary", "text": "The portfolio values and internal result are not independently reproduced by this pack." }
    ],
    "verdictDetail": "Open pending independent review and reproduction.",
    "verdictBody": "The cited sources provide background context but do not independently establish every aggregate, threshold, or internal result carried by the draft article.",
    "orientation": "The following pages preserve representative article figures with captions, a compact data table, the methodology note, credits, and a bibliography. Figure numbering and source lines remain stable between builds."
  },
  "figures": [
    {
      "id": "fig-climate-impact",
      "title": "Five Material Classes Could Unlock 5–12 GtCO₂/Year",
      "path": "images/five-materials-for-5-to-12-gtco2-year-01-climate-impact.jpg",
      "alt": "Horizontal comparison of five material classes and their estimated annual climate impact ranges.",
      "caption": "Draft article scenario figure, preserved byte-for-byte. Its aggregate range remains needs-verification in this pack.",
      "sourceIds": [],
      "sha256": "79f211704fe346db1070d7b960fe673e1d2f911b1a93bfd35101149f4ce8f3de"
    },
    {
      "id": "fig-blind-prediction",
      "title": "Blind Prediction of Surface Energies Across 36 Model–Material Pairs",
      "path": "images/five-materials-for-5-to-12-gtco2-year-04-blind-prediction-accuracy.jpg",
      "alt": "Scatter plot comparing measured and predicted surface-energy errors across 36 model-material pairs.",
      "caption": "Draft article result figure, preserved byte-for-byte. Its internal blind-prediction result remains needs-verification in this pack.",
      "sourceIds": [],
      "sha256": "0ed613dc0b3315bfee564ae2ca41f09196e314596b0db7b84e59da38a1de4140"
    }
  ],
  "dataTables": [
    {
      "id": "table-targets",
      "title": "Representative targets",
      "caption": "Representative targets carried from the article into the proof pack.",
      "headers": [
        { "key": "pathway", "label": "Material pathway" },
        { "key": "metric", "label": "Decision metric" },
        { "key": "target", "label": "Target", "numeric": true }
      ],
      "rows": [
        { "pathway": "Cobalt-free LMR cathode", "metric": "Cell-level energy density", "target": ">300 Wh/kg" },
        { "pathway": "Halide solid electrolyte", "metric": "Ionic conductivity", "target": ">10 mS/cm" },
        { "pathway": "MOF sorbent", "metric": "CO₂ working capacity at 400 ppm", "target": ">2 mmol/g" },
        { "pathway": "Ammonia catalyst", "metric": "Energy efficiency", "target": ">60%" },
        { "pathway": "Lead-free perovskite", "metric": "Certified conversion efficiency", "target": ">20%" }
      ],
      "sourceIds": []
    }
  ],
  "methodology": {
    "description": "Claims are selected from the draft article's explicit statements, byte-pinned, and kept separate from background bibliography when the cited sources do not independently establish them.",
    "steps": [
      "Identify decision-relevant quantitative claims in the article.",
      "Select figures that preserve complete axes, labels, legends, and annotations.",
      "Copy values without reinterpretation; state transformations and exclusions.",
      "Map an artifact to a bibliography entry only when that source independently establishes the artifact's claim; otherwise retain an empty source list and needs-verification label."
    ],
    "artifacts": [],
    "unitOfAnalysis": "Material class and defect-mediated performance metric",
    "evidenceCutoff": "2026-07-09",
    "versioning": "Deterministic HTML/CSS build; source URL and document ID printed on cover",
    "limitations": "Impact ranges are conditional scenarios; commercial outcomes are not guaranteed.",
    "inputs": ["Article source notes", "Cited peer-reviewed and official sources"],
    "transformations": ["None; values are copied as stated and are not independently inferred."],
    "validation": ["Bibliography cross-check", "Source-domain policy validation", "Builder-enforced figure digest verification"],
    "reproduction": ["Repository-local build scripts", "Article HTML and image assets"]
  },
  "credits": {
    "authors": [
      { "name": "Alex Welcing", "role": "Author" }
    ],
    "institutions": [
      { "name": "Lupine Science", "role": "Institution" }
    ],
    "editorialReview": "Independent editorial and scientific review status: needs verification",
    "provenance": "Article source notes and bibliography",
    "contact": "https://lupine.science/contact/"
  },
  "bibliography": [
    {
      "id": "deng-2025",
      "title": "Systematic softening in universal machine learning interatomic potentials",
      "type": "peer-reviewed",
      "url": "https://doi.org/10.1038/s41524-024-01500-6",
      "doi": "10.1038/s41524-024-01500-6",
      "publisher": "npj Computational Materials",
      "year": 2025
    },
    {
      "id": "iea-batteries-2024",
      "title": "Batteries and Secure Energy Transitions",
      "type": "intergovernmental",
      "url": "https://www.iea.org/reports/batteries-and-secure-energy-transitions",
      "publisher": "International Energy Agency",
      "year": 2024
    },
    {
      "id": "ipcc-ar6-2022",
      "title": "Climate Change 2022: Mitigation of Climate Change",
      "type": "intergovernmental",
      "url": "https://www.ipcc.ch/report/ar6/wg3/",
      "publisher": "IPCC",
      "year": 2022
    },
    {
      "id": "arpa-e-refuel-2020",
      "title": "REFUEL: Renewable Energy to Fuels Through Utilization of Energy-Dense Liquids",
      "type": "government",
      "url": "https://arpa-e.energy.gov/technologies/programs/refuel",
      "publisher": "ARPA-E, U.S. Department of Energy",
      "year": 2020
    }
  ],
  "auditLinks": [
    { "label": "Canonical article", "url": "https://lupine.science/articles/five-materials-for-5-to-12-gtco2-year/" }
  ]
}
